{
  "version": "roughcut_plan.v1",
  "summary": "30s founder story; opens with strongest line from take 2; cutaway B-roll mid-clip.",
  "timeline": {
    "fps": 30.0,
    "tracks": [
      {
        "kind": "video",
        "id": "v1",
        "clips": [
          {
            "asset_id": "a_take2",
            "src_in": 12.5,
            "src_out": 18.2,
            "timeline_in": 0.0,
            "lane": 0,
            "reason": "strongest hook (take 2)"
          },
          {
            "asset_id": "a_broll",
            "src_in": 5.0,
            "src_out": 11.0,
            "timeline_in": 5.7,
            "lane": 0,
            "reason": "cutaway"
          },
          {
            "asset_id": "a_take2",
            "src_in": 33.0,
            "src_out": 51.3,
            "timeline_in": 11.7,
            "lane": 0,
            "reason": "main story body"
          }
        ]
      }
    ]
  },
  "captions": [
    {
      "timeline_in": 0.0,
      "timeline_out": 5.7,
      "text": "We knew we had something the day we shipped to one customer."
    }
  ],
  "warnings": []
}
